[
  {
    "schema_version": 1,
    "status": "compatible",
    "code": null,
    "mismatched_fields": [],
    "recovery_action": "check_gateway_and_current_policy",
    "dispatch_allowed": false,
    "requires_gateway_readiness": true,
    "requires_current_policy_evaluation": true,
    "transfer_authorized": false
  },
  {
    "schema_version": 1,
    "status": "incompatible",
    "code": "desktop.resume_incompatible",
    "mismatched_fields": [
      "organization_id"
    ],
    "recovery_action": "explicit_reauthorization_and_context_transfer",
    "dispatch_allowed": false,
    "requires_gateway_readiness": true,
    "requires_current_policy_evaluation": true,
    "transfer_authorized": false
  }
]
